{
 "schema_version": 1,
 "id": "q-001",
 "draft": "dr-001",
 "draft_file": "drafts/dr-001.md",
 "final_file": ".state/edit-queue/q-001.final.md",
 "source": "/home/sam/Writing/Published/2026-10-04-the-shed.md",
 "found": "2026-10-05T07:00:00Z",
 "profile": "sam",
 "slot": "en.essay",
 "share": 0.83,
 "status": "waiting"
}
